verse|book|quote
08-03|Luke|Jo·anʹna the wife of Chuʹza, Herod’s man in charge; Su·sanʹna; and many other women, who were ministering to them from their belongings.
08-04|Luke|Now when a large crowd had gathered together with those who went to him from city to city, he spoke by means of an illustration:
08-05|Luke|“A sower went out to sow his seed. As he was sowing, some of them fell alongside the road and were trampled on, and the birds of heaven ate them up.
08-06|Luke|Some landed on the rock, and after sprouting, they dried up because they had no moisture.
08-07|Luke|Others fell among the thorns, and the thorns that grew up with them choked them.
08-08|Luke|But others fell on the good soil, and after sprouting, they produced 100 times more fruit.” As he said these things, he called out: “Let the one who has ears to listen, listen.”
08-09|Luke|But his disciples asked him what this illustration meant.
08-10|Luke|He said: “To you it is granted to understand the sacred secrets of the Kingdom of God, but for the rest it is in illustrations so that, though looking, they may look in vain, and though hearing, they may not get the sense.
08-11|Luke|Now the illustration means this: The seed is the word of God.
08-12|Luke|Those alongside the road are the ones who have heard, and then the Devil comes and takes the word away from their hearts so that they may not believe and be saved.
08-13|Luke|Those on the rock are the ones who, when they hear the word, receive it with joy, but these have no root. They believe for a while, but in a season of testing, they fall away.
08-14|Luke|As for that which fell among the thorns, these are the ones who have heard, but by being carried away by anxieties, riches, and pleasures of this life, they are completely choked and bring nothing to maturity.
08-15|Luke|As for that on the fine soil, these are the ones who, after hearing the word with a fine and good heart, retain it and bear fruit with endurance.
08-16|Luke|“No one after lighting a lamp covers it with a vessel or puts it underneath a bed, but he puts it on a lampstand so that those who come in may see the light.
08-17|Luke|For there is nothing hidden that will not become manifest, nor anything carefully concealed that will never become known and not come out in the open.
08-18|Luke|Therefore, pay attention to how you listen, for whoever has will be given more, but whoever does not have, even what he imagines he has will be taken away from him.”
08-19|Luke|Now his mother and brothers came to him, but they were unable to get near him because of the crowd.
08-20|Luke|So it was reported to him: “Your mother and your brothers are standing outside, wanting to see you.”
08-21|Luke|In reply he said to them: “My mother and my brothers are these who hear the word of God and do it.”
08-22|Luke|One day he and his disciples got into a boat, and he said to them: “Let us cross to the other side of the lake.” So they set sail.
08-23|Luke|But as they were sailing along, he fell asleep. And a violent windstorm descended on the lake, and their boat began to fill up with water and to be in danger.
08-24|Luke|So they went and woke him up, saying: “Instructor, Instructor, we are about to perish!” With that he got up and rebuked the wind and the raging of the water, and they subsided, and a calm set in.
08-25|Luke|Then he said to them: “Where is your faith?” But they were filled with fear and were astounded, saying to one another: “Who really is this? For he orders even the winds and the water, and they obey him.”
08-26|Luke|And they put in to shore in the region of the Gerʹa·senes, which is on the side opposite Galʹi·lee.
08-27|Luke|As Jesus got out onto land, a demon-possessed man from the city met him. For a considerable time he had not worn clothing, and he was staying, not in a house, but among the tombs.
08-28|Luke|At the sight of Jesus, he cried out and fell down before him, and with a loud voice, he said: “What have I to do with you, Jesus, Son of the Most High God? I beg you, do not torment me.”
08-29|Luke|(For Jesus had been ordering the unclean spirit to come out of the man. It had seized him on many occasions, and he was repeatedly bound with chains and fetters and kept under guard, but he would break the bonds and be driven by the demon into the isolated places.)
08-30|Luke|Jesus asked him: “What is your name?” He said: “Legion,” for many demons had entered into him.
08-31|Luke|And they kept pleading with him not to order them to go away into the abyss.
08-32|Luke|Now a large herd of swine was feeding there on the mountain, so they pleaded with him to permit them to enter into the swine, and he gave them permission.
08-33|Luke|With that the demons came out of the man and went into the swine, and the herd rushed over the precipice into the lake and drowned.
08-34|Luke|But when the herders saw what had happened, they fled and reported it in the city and in the countryside.
08-35|Luke|Then people went out to see what had happened. They came to Jesus and found the man from whom the demons had come out, clothed and in his right mind, sitting at the feet of Jesus, and they grew fearful.
08-36|Luke|Those who had seen it reported to them how the demon-possessed man had been made well.
08-37|Luke|Then a great number from the surrounding region of the Gerʹa·senes asked Jesus to go away from them, because they were gripped by great fear. Then he went aboard the boat to depart.
08-38|Luke|However, the man from whom the demons had gone out kept begging to continue with him, but he sent the man away, saying:
08-39|Luke|“Go back home, and keep on relating what God did for you.” So he went away, proclaiming throughout the whole city what Jesus had done for him.
08-40|Luke|When Jesus returned, the crowd received him kindly, for they were all expecting him.
08-41|Luke|But look! a man named Jaʹi·rus came; this man was a presiding officer of the synagogue. And he fell at the feet of Jesus and began to plead with him to come to his house,
08-42|Luke|because his only daughter, who was about 12 years old, was dying. As Jesus was going, the crowds pressed in on him.
08-43|Luke|Now there was a woman who had a flow of blood for 12 years, and she had not been able to get a cure from anyone.
08-44|Luke|She approached from behind and touched the fringe of his outer garment, and immediately her flow of blood stopped.
08-45|Luke|So Jesus said: “Who touched me?” When they were all denying it, Peter said: “Instructor, the crowds are hemming you in and pressing against you.”
08-46|Luke|But Jesus said: “Someone touched me, for I know that power went out of me.”
08-47|Luke|Seeing that she had not escaped notice, the woman came trembling and fell down before him and declared before all the people why she touched him and how she was healed immediately.
08-48|Luke|But he said to her: “Daughter, your faith has made you well. Go in peace.”
08-49|Luke|While he was yet speaking, a representative of the presiding officer of the synagogue came, saying: “Your daughter has died; do not bother the Teacher any longer.” 50 On hearing this, Jesus answered him: “Have no fear, only have faith, and she will be saved.”
08-51|Luke|When he reached the house, he did not let anyone go in with him except Peter, John, James, and the girl’s father and mother.
08-52|Luke|But people were all weeping and beating themselves in grief for her. So he said: “Stop weeping, for she did not die but is sleeping.”
08-53|Luke|At this they began to laugh at him scornfully, because they knew she had died.
08-54|Luke|But he took her by the hand and called to her: “Child, get up!”
08-55|Luke|And her spirit returned, and she rose immediately, and he ordered that something be given her to eat.
08-56|Luke|Well, her parents were beside themselves, but he instructed them to tell no one what had happened.
09-01|Luke|Then he called the Twelve together and gave them power and authority over all the demons and to cure diseases.
09-02|Luke|And he sent them out to preach the Kingdom of God and to heal,
09-03|Luke|and he said to them: “Carry nothing for the trip, neither staff nor food pouch nor bread nor money; neither have two garments.
09-04|Luke|But wherever you enter into a home, stay there and leave from there.
09-05|Luke|And wherever people do not receive you, on going out of that city, shake the dust off your feet for a witness against them.”
09-06|Luke|Then starting out, they went through the territory from village to village, declaring the good news and performing cures everywhere.
09-07|Luke|Now Herod the district ruler heard about everything that was happening, and he was greatly perplexed because some were saying that John had been raised up from the dead,
09-08|Luke|but others were saying that E·liʹjah had appeared, and still others that one of the ancient prophets had risen.
09-09|Luke|Herod said: “John I beheaded. Who, then, is this about whom I am hearing such things?” So he was trying to see him.
09-10|Luke|When the apostles returned, they reported to Jesus all they had done. With that he took them along and withdrew privately into a city called Beth·saʹi·da.
09-11|Luke|But the crowds, getting to know it, followed him. And he received them kindly and began to speak to them about the Kingdom of God, and he healed those needing a cure.
09-12|Luke|Then the day was coming to a close. The Twelve now came up and said to him: “Send the crowd away, so that they may go into the surrounding villages and countryside to find lodging and provisions, because out here we are in an isolated place.”
09-13|Luke|But he said to them: “You give them something to eat.” They said: “We have nothing more than five loaves and two fish, unless perhaps we ourselves go and buy food for all these people.”
09-14|Luke|There were, in fact, about 5,000 men. But he said to his disciples: “Have them sit down in groups of about 50 each.”
09-15|Luke|And they did so and had them all sit down.
09-16|Luke|Taking now the five loaves and the two fish, he looked up to heaven and blessed them. Then he broke them up and began giving them to the disciples to set before the crowd.
09-17|Luke|So they all ate and were satisfied, and they took up the leftovers, 12 baskets of fragments.
09-18|Luke|Later, while he was praying alone, the disciples came to him, and he questioned them, saying: “Who are the crowds saying that I am?”
09-19|Luke|In reply they said: “John the Baptist, but others say E·liʹjah, and still others say that one of the ancient prophets has risen.”
09-20|Luke|Then he said to them: “You, though, who do you say I am?” Peter answered: “The Christ of God.”
09-21|Luke|Then in a stern talk to them, he instructed them not to tell this to anybody,
09-22|Luke|but he said: “The Son of man must undergo many sufferings and be rejected by the elders and the chief priests and the scribes and be killed, and on the third day be raised up.”
09-23|Luke|Then he went on to say to all: “If anyone wants to come after me, let him disown himself and pick up his torture stake day after day and keep following me.
09-24|Luke|For whoever wants to save his life will lose it, but whoever loses his life for my sake is the one who will save it.
09-25|Luke|Really, what good will it do a man if he gains the whole world but loses his own self or suffers ruin?
09-26|Luke|For whoever becomes ashamed of me and of my words, the Son of man will be ashamed of that person when he comes in his glory and that of the Father and of the holy angels.
09-27|Luke|But I tell you truly, there are some of those standing here who will not taste death at all until first they see the Kingdom of God.”
09-28|Luke|In fact, about eight days after saying these words, he took Peter, John, and James along and climbed up the mountain to pray.
09-29|Luke|And as he was praying, the appearance of his face changed and his clothing became glitteringly white.
09-30|Luke|And look! two men were conversing with him; they were Moses and E·liʹjah.
09-31|Luke|These appeared with glory and began talking about his departure, which he was about to fulfill at Jerusalem.
09-32|Luke|Now Peter and those with him were weighed down with sleep, but when they became fully awake, they saw his glory and the two men standing with him.
09-33|Luke|And as these were departing from him, Peter said to Jesus: “Instructor, it is fine for us to be here. So let us erect three tents, one for you, one for Moses, and one for E·liʹjah.” He did not realize what he was saying.
09-34|Luke|But as he was saying these things, a cloud formed and began to overshadow them. As they entered into the cloud, they became afraid.
09-35|Luke|Then a voice came out of the cloud, saying: “This is my Son, the one who has been chosen. Listen to him.”
09-36|Luke|As the voice spoke, Jesus was found alone. But they kept quiet and did not report to anyone in those days any of the things they saw.
09-37|Luke|The following day when they came down from the mountain, a large crowd met him.
09-38|Luke|And look! a man called out from the crowd, saying: “Teacher, I beg you to take a look at my son, because he is my only one.
09-39|Luke|And look! a spirit seizes him, and suddenly he cries out, and it throws him into convulsions with foaming at the mouth, and only with difficulty does it leave him after bruising him.
09-40|Luke|I begged your disciples to expel it, but they could not.”
09-41|Luke|In response Jesus said: “O faithless and twisted generation, how long must I continue with you and put up with you? Bring your son over here.”
09-42|Luke|But even as he was approaching, the demon hurled him to the ground and violently threw him into a convulsion. However, Jesus rebuked the unclean spirit and healed the boy and gave him back to his father.
09-43|Luke|And they were all astounded at the majestic power of God. While they were all astonished at all the things he was doing, he said to his disciples:
09-44|Luke|“Listen carefully and remember these words, for the Son of man is going to be betrayed into men’s hands.”
09-45|Luke|But they did not understand what he was saying. In fact, it was concealed from them so that they might not grasp it, and they were afraid to question him about this saying.
09-46|Luke|Then a dispute arose among them about which one of them was the greatest.
09-47|Luke|Jesus, knowing the reasoning of their hearts, took a young child, stood him beside him,
09-48|Luke|and said to them: “Whoever receives this young child on the basis of my name receives me also; and whoever receives me also receives the One who sent me. For the one who conducts himself as a lesser one among all of you is the one who is great.”
09-49|Luke|In response John said: “Instructor, we saw someone expelling demons by using your name, and we tried to prevent him, because he is not following with us.”
09-50|Luke|But Jesus said to him: “Do not try to prevent him, for whoever is not against you is for you.”
09-51|Luke|As the days were drawing near for him to be taken up, he resolutely set his face to go to Jerusalem.
09-52|Luke|So he sent messengers ahead of him. And they went and entered a village of Sa·marʹi·tans to make preparations for him.
09-53|Luke|But they did not receive him, because he was determined to go to Jerusalem.
09-54|Luke|When the disciples James and John saw this, they said: “Lord, do you want us to call fire down from heaven and annihilate them?”
09-55|Luke|But he turned and rebuked them.
09-56|Luke|So they went to a different village.
09-57|Luke|Now as they were going along the road, someone said to him: “I will follow you wherever you go.”
09-58|Luke|But Jesus said to him: “Foxes have dens and birds of heaven have nests, but the Son of man has nowhere to lay down his head.”
09-59|Luke|Then he said to another: “Be my follower.” The man said: “Lord, permit me first to go and bury my father.”
10-01|Luke|After these things the Lord designated 70 others and sent them out by twos ahead of him into every city and place where he himself was to go.
10-02|Luke|Then he said to them: “Yes, the harvest is great, but the workers are few. Therefore, beg the Master of the harvest to send out workers into his harvest.
10-03|Luke|Go! Look! I am sending you out as lambs in among wolves.
10-04|Luke|Do not carry a money bag or a food pouch or sandals, and do not greet anyone along the road.
10-05|Luke|Wherever you enter into a house, say first: ‘May this house have peace.’
10-06|Luke|And if a friend of peace is there, your peace will rest upon him. But if there is not, it will return to you.
10-07|Luke|So stay in that house, eating and drinking the things they provide, for the worker is worthy of his wages. Do not keep transferring from house to house.
10-08|Luke|“Also, wherever you enter into a city and they receive you, eat what is set before you
10-09|Luke|and cure the sick ones in it and tell them: ‘The Kingdom of God has come near to you.’
10-10|Luke|But wherever you enter into a city and they do not receive you, go out into its main streets and say:
10-11|Luke|‘We wipe off against you even the dust that sticks to our feet from your city. Nevertheless, know this, that the Kingdom of God has come near.’
10-12|Luke|I tell you that it will be more endurable for Sodʹom in that day than for that city.
10-13|Luke|“Woe to you, Cho·raʹzin! Woe to you, Beth·saʹi·da! because if the powerful works that have taken place in you had taken place in Tyre and Siʹdon, they would long ago have repented, sitting in sackcloth and ashes.
10-14|Luke|Consequently, it will be more endurable for Tyre and Siʹdon in the judgment than for you.
10-15|Luke|And you, Ca·perʹna·um, will you perhaps be exalted to heaven? Down to the Grave you will come!
10-16|Luke|“Whoever listens to you listens to me. And whoever disregards you disregards me also. Moreover, whoever disregards me disregards also Him who sent me.”
10-17|Luke|Then the 70 returned with joy, saying: “Lord, even the demons are made subject to us by the use of your name.”
10-18|Luke|At that he said to them: “I see Satan already fallen like lightning from heaven.
10-19|Luke|Look! I have given you the authority to trample underfoot serpents and scorpions, and over all the power of the enemy, and nothing at all will harm you.
10-20|Luke|Nevertheless, do not rejoice because the spirits are made subject to you, but rejoice because your names have been written in the heavens.”
10-21|Luke|In that very hour he became overjoyed in the holy spirit and said: “I publicly praise you, Father, Lord of heaven and earth, because you have carefully hidden these things from wise and intellectual ones and have revealed them to young children. Yes, O Father, because this is the way you approved.
10-22|Luke|All things have been handed over to me by my Father, and no one knows who the Son is except the Father, and no one knows who the Father is except the Son and anyone to whom the Son is willing to reveal him.”
10-23|Luke|With that he turned to the disciples and told them privately: “Happy are the eyes that see the things you are seeing.
10-24|Luke|For I say to you, many prophets and kings desired to see the things you are observing but did not see them, and to hear the things you are hearing but did not hear them.”
10-25|Luke|Now look! a man versed in the Law stood up to test him and said: “Teacher, what do I need to do to inherit everlasting life?”
10-26|Luke|He said to him: “What is written in the Law? How do you read?”
10-27|Luke|In answer he said: “‘You must love Jehovah your God with your whole heart and with your whole soul and with your whole strength and with your whole mind’ and ‘your neighbor as yourself.’”
10-28|Luke|He said to him: “You answered correctly; keep doing this and you will get life.”
10-29|Luke|But wanting to prove himself righteous, the man said to Jesus: “Who really is my neighbor?”
10-30|Luke|In reply Jesus said: “A man was going down from Jerusalem to Jerʹi·cho and fell victim to robbers, who stripped him, beat him, and went off, leaving him half-dead.
10-31|Luke|Now by coincidence a priest was going down on that road, but when he saw him, he passed by on the opposite side.
10-32|Luke|Likewise, a Levite, when he came to the place and saw him, passed by on the opposite side.
10-33|Luke|But a certain Sa·marʹi·tan traveling the road came upon him, and at seeing him, he was moved with pity.
10-34|Luke|So he approached him and bandaged his wounds, pouring oil and wine on them. Then he mounted him on his own animal and brought him to an inn and took care of him.
10-35|Luke|The next day he took out two de·narʹi·i, gave them to the innkeeper, and said: ‘Take care of him, and whatever you spend besides this, I will repay you when I return.’
10-36|Luke|Who of these three seems to you to have made himself neighbor to the man who fell victim to the robbers?”
10-37|Luke|He said: “The one who acted mercifully toward him.” Jesus then said to him: “Go and do the same yourself.”
10-38|Luke|Now as they went on their way, he entered into a certain village. Here a woman named Martha received him as a guest in her house.
10-39|Luke|She also had a sister called Mary, who sat down at the feet of the Lord and kept listening to what he was saying.
10-40|Luke|Martha, on the other hand, was distracted with attending to many duties. So she came to him and said: “Lord, does it not matter to you that my sister has left me alone to attend to things? Tell her to come and help me.”
10-41|Luke|In answer the Lord said to her: “Martha, Martha, you are anxious and disturbed about many things.
10-42|Luke|A few things, though, are needed, or just one. For her part, Mary chose the good portion, and it will not be taken away from her.”
11-01|Luke|Now he was in a certain place praying, and when he stopped, one of his disciples said to him: “Lord, teach us how to pray, just as John also taught his disciples.”
11-02|Luke|So he said to them: “Whenever you pray, say: ‘Father, let your name be sanctified. Let your Kingdom come.
11-03|Luke|Give us each day our bread according to our daily needs.
11-04|Luke|And forgive us our sins, for we ourselves also forgive everyone who is in debt to us; and do not bring us into temptation.’”
11-05|Luke|Then he said to them: “Suppose one of you has a friend and you go to him at midnight and say to him, ‘Friend, lend me three loaves,
11-06|Luke|because one of my friends has just come to me on a journey and I have nothing to offer him.’
11-07|Luke|But that one replies from inside: ‘Stop bothering me. The door is already locked, and my young children are with me in bed. I cannot get up and give you anything.’
11-08|Luke|I tell you, even if he will not get up and give him anything because of being his friend, certainly because of his bold persistence he will get up and give him whatever he needs.
11-09|Luke|So I say to you, keep on asking, and it will be given you; keep on seeking, and you will find; keep on knocking, and it will be opened to you.
11-10|Luke|For everyone asking receives, and everyone seeking finds, and to everyone knocking, it will be opened.
11-11|Luke|Indeed, which father among you, if his son asks for a fish, will hand him a serpent instead of a fish?
11-12|Luke|Or if he also asks for an egg, will hand him a scorpion?
11-13|Luke|Therefore, if you, although being wicked, know how to give good gifts to your children, how much more so will the Father in heaven give holy spirit to those asking him!”
11-14|Luke|Later he expelled a speechless demon. After the demon came out, the speechless man spoke, and the crowds were amazed.
11-15|Luke|But some of them said: “He expels the demons by means of Be·elʹze·bub, the ruler of the demons.”
11-16|Luke|And others, to test him, began demanding a sign out of heaven from him.
11-17|Luke|Knowing their thinking, he said to them: “Every kingdom divided against itself comes to ruin, and a house divided against itself falls.
11-18|Luke|In the same way, if Satan is also divided against himself, how will his kingdom stand? For you say I expel the demons by means of Be·elʹze·bub.
11-19|Luke|If I expel the demons by means of Be·elʹze·bub, by whom do your sons expel them? This is why they will be your judges.
11-20|Luke|But if it is by means of God’s finger that I expel the demons, the Kingdom of God has really overtaken you.
11-21|Luke|When a strong, well-armed man guards his palace, his belongings remain secure.
11-22|Luke|But when someone stronger than he is comes against him and conquers him, that man takes away all his weapons in which he was trusting, and he divides up the things he took from him.
11-23|Luke|Whoever is not on my side is against me, and whoever does not gather with me scatters.
11-24|Luke|“When an unclean spirit comes out of a man, it passes through waterless places in search of a resting-place, and after finding none, it says, ‘I will return to my house from which I moved.’
11-25|Luke|And on arriving, it finds the house swept clean and adorned.
11-26|Luke|Then it goes and takes along seven other spirits more wicked than itself, and after getting inside, they dwell there. So the final circumstances of that man become worse than the first.”
11-27|Luke|Now as he was saying these things, a woman from the crowd called out to him: “Happy is the womb that carried you and the breasts that nursed you!”
11-28|Luke|But he said: “No, rather, happy are those hearing the word of God and keeping it!”
11-29|Luke|When the crowds were massing together, he began to say: “This generation is a wicked generation; it looks for a sign, but no sign will be given to it except the sign of Joʹnah.
