verse|book|quote
08-44|1 Kings|“If your people go to war against their enemy in the way that you send them, and they pray to Jehovah in the direction of the city that you have chosen and toward the house that I have built for your name,
08-45|1 Kings|then hear from the heavens their prayer and their request for favor and execute judgment for them.
08-46|1 Kings|“If they sin against you (for there is no man who does not sin), and you are furious with them and you abandon them to an enemy, and their captors carry them off captive to the land of the enemy, far or near;
08-47|1 Kings|and they come to their senses in the land where they were carried off captive, and they return to you and beg you for favor in the land of their captors, saying, ‘We have sinned and done wrong; we have acted wickedly,’
08-48|1 Kings|and they return to you with all their heart and all their soul in the land of their enemies who carried them off captive, and they pray to you in the direction of their land that you gave to their forefathers and of the city that you have chosen and the house that I have built for your name,
08-49|1 Kings|then hear from the heavens, your dwelling place, their prayer and their request for favor, and execute judgment for them
08-50|1 Kings|and forgive your people who have sinned against you, forgiving all their transgressions they committed against you. You will make them objects of pity before their captors, and they will pity them
08-51|1 Kings|(for they are your people and your inheritance, whom you brought out of Egypt, from inside the iron-smelting furnace).
08-52|1 Kings|May your eyes be opened to your servant’s request for favor and to the request for favor by your people Israel by listening whenever they call to you.
08-53|1 Kings|For you set them apart as your inheritance out of all the peoples of the earth, just as you declared through Moses your servant when you were bringing our forefathers out of Egypt, O Sovereign Lord Jehovah.”
08-54|1 Kings|And as soon as Solʹo·mon finished offering to Jehovah this entire prayer and request for favor, he rose up from before the altar of Jehovah, where he had been kneeling with his hands spread out to the heavens.
08-55|1 Kings|He then stood and blessed all the congregation of Israel with a loud voice, saying:
08-56|1 Kings|“Praised be Jehovah, who has given a resting-place to his people Israel, just as he promised. Not one word of all his good promise that he made through Moses his servant has failed.
08-57|1 Kings|May Jehovah our God be with us just as he was with our forefathers. May he not abandon us nor forsake us.
08-58|1 Kings|May he draw our heart toward himself, to walk in all his ways and to keep his commandments, his regulations, and his judgments, which he commanded our forefathers to observe.
08-59|1 Kings|And may these words of mine with which I have begged Jehovah for favor be near to Jehovah our God by day and night, that he may execute judgment for his servant and for his people Israel as each day requires,
18-01|1 Kings|After some time, in the third year, Jehovah’s word came to E·liʹjah, saying: “Go, present yourself to Aʹhab, and I will send rain on the surface of the ground.”
18-02|1 Kings|So E·liʹjah went to present himself to Aʹhab, while the famine was severe in Sa·marʹi·a.
18-03|1 Kings|Meanwhile, Aʹhab called O·ba·diʹah, who was over the household. (Now O·ba·diʹah greatly feared Jehovah,
18-04|1 Kings|and when Jezʹe·bel was doing away with Jehovah’s prophets, O·ba·diʹah took 100 prophets and hid them 50 to a cave, and he supplied them with bread and water.)
18-05|1 Kings|Aʹhab then said to O·ba·diʹah: “Go through the land to all the springs of water and to all the valleys. Perhaps we can find enough grass to keep the horses and mules alive and not have all our animals die.”
18-06|1 Kings|So they divided between themselves the land they were going to pass through. Aʹhab went alone by one way, and O·ba·diʹah went alone by another way.
18-07|1 Kings|As O·ba·diʹah was on his way, E·liʹjah was there to meet him. At once he recognized him and fell facedown and said: “Is this you, my lord E·liʹjah?”
18-08|1 Kings|He replied to him: “It is I. Go and tell your lord: ‘E·liʹjah is here.’”
18-09|1 Kings|But he said: “What sin have I committed that you should hand your servant over to Aʹhab to put me to death?
18-10|1 Kings|As surely as Jehovah your God is living, there is not a nation or a kingdom where my lord has not sent to look for you. After they said, ‘He is not here,’ he made the kingdom and the nation swear that they could not find you.
18-11|1 Kings|Now you are saying, ‘Go and tell your lord: “E·liʹjah is here.”’
18-12|1 Kings|When I depart from you, the spirit of Jehovah will carry you away to a place I will not know, and when I tell Aʹhab and he does not find you, he will surely kill me. Yet, your servant has feared Jehovah from his youth.
18-13|1 Kings|Has my lord not been told what I did when Jezʹe·bel was killing the prophets of Jehovah, how I hid 100 of the prophets of Jehovah by groups of 50 in a cave and kept supplying them bread and water?
18-14|1 Kings|But now you are saying, ‘Go and tell your lord: “E·liʹjah is here.”’ He will certainly kill me.”
18-15|1 Kings|However, E·liʹjah said: “As surely as Jehovah of armies whom I serve is living, today I will present myself to him.”
18-16|1 Kings|So O·ba·diʹah went off to meet Aʹhab and told him, and Aʹhab went to meet E·liʹjah.
18-17|1 Kings|As soon as Aʹhab saw E·liʹjah, he said to him: “Is this you, the one bringing great trouble on Israel?”
18-18|1 Kings|To this he said: “I have not brought trouble on Israel, but you and the house of your father have, by abandoning the commandments of Jehovah and by following the Baʹals.
18-19|1 Kings|And now summon all Israel to me at Mount Carʹmel, as well as the 450 prophets of Baʹal and the 400 prophets of the sacred pole, who are eating at the table of Jezʹe·bel.”
18-20|1 Kings|So Aʹhab sent word among all the people of Israel and collected the prophets together at Mount Carʹmel.
18-21|1 Kings|Then E·liʹjah approached all the people and said: “How long will you be limping between two different opinions? If Jehovah is the true God, follow him; but if Baʹal is, follow him!” But the people did not say a word in answer to him.
18-22|1 Kings|E·liʹjah then said to the people: “I am the only prophet of Jehovah left, while the prophets of Baʹal are 450 men.
18-23|1 Kings|Let them give us two young bulls, and let them choose one young bull and cut it into pieces and put it on the wood, but they should not put fire to it. I will prepare the other young bull, and I will place it on the wood, but I will not put fire to it.
18-24|1 Kings|Then you must call on the name of your god, and I will call on the name of Jehovah. The God who answers by fire will show that he is the true God.” To this all the people answered: “What you say is good.”
18-25|1 Kings|E·liʹjah now said to the prophets of Baʹal: “Choose one young bull and prepare it first, because you are the majority. Then call on the name of your god, but you must not put fire to it.”
18-26|1 Kings|So they took the young bull that was given to them, prepared it, and kept calling on the name of Baʹal from morning until noon, saying: “O Baʹal, answer us!” But there was no voice and no one answering. They kept limping around the altar that they had made.
18-27|1 Kings|About noon E·liʹjah began to mock them and say: “Call out at the top of your voice! After all, he is a god! Perhaps he is deep in thought or he has gone to relieve himself. Or maybe he is asleep and someone needs to wake him up!”
18-28|1 Kings|They were calling out at the top of their voice and cutting themselves with daggers and lances, according to their custom, until their blood gushed out all over them.
18-29|1 Kings|Noon was past and they continued in a frenzy until the time the evening grain offering is presented, but there was no voice and no one answering; no one was paying attention.
18-30|1 Kings|At length E·liʹjah said to all the people: “Approach me.” So all the people approached him. Then he repaired the altar of Jehovah that had been torn down.
18-31|1 Kings|E·liʹjah then took 12 stones, corresponding to the number of the tribes of the sons of Jacob, to whom Jehovah’s word had come, saying: “Israel will be your name.”
18-32|1 Kings|With the stones he built an altar in the name of Jehovah. Then he made a trench all around the altar, an area large enough to sow with two seah measures of seed.
18-33|1 Kings|After that he put the pieces of wood in order, cut the young bull into pieces, and placed it on the wood. He now said: “Fill four large jars with water and pour it on the burnt offering and on the pieces of wood.”
18-34|1 Kings|Then he said: “Do it again.” So they did it again. Once more he said: “Do it a third time.” So they did it a third time.
18-35|1 Kings|And the water ran all around the altar, and he also filled the trench with water.
18-36|1 Kings|About the time when the evening grain offering is presented, E·liʹjah the prophet stepped forward and said: “O Jehovah, the God of Abraham, Isaac, and Israel, today let it be known that you are God in Israel and that I am your servant and that it is by your word that I have done all these things.
18-37|1 Kings|Answer me, O Jehovah! Answer me so that this people may know that you, Jehovah, are the true God and that you are turning their hearts back to you.”
18-38|1 Kings|At that the fire of Jehovah fell from above and consumed the burnt offering, the pieces of wood, the stones, and the dust, and it licked up the water from the trench.
18-39|1 Kings|When all the people saw it, they immediately fell facedown and said: “Jehovah is the true God! Jehovah is the true God!”
18-40|1 Kings|Then E·liʹjah said to them: “Seize the prophets of Baʹal! Do not let a single one of them escape!” At once they seized them, and E·liʹjah brought them down to the stream of Kiʹshon and slaughtered them there.
18-41|1 Kings|E·liʹjah now said to Aʹhab: “Go up, eat and drink, for there is the sound of a heavy downpour.”
18-42|1 Kings|So Aʹhab went up to eat and drink, while E·liʹjah went up to the top of Carʹmel and crouched on the ground, keeping his face between his knees.
18-43|1 Kings|Then he said to his attendant: “Go up, please, and look toward the sea.” So he went up and looked and said: “There is nothing at all.” Seven times E·liʹjah said, “Go back.”
18-44|1 Kings|The seventh time his attendant said: “Look! There is a small cloud like a man’s hand ascending out of the sea.” He now said: “Go, say to Aʹhab, ‘Hitch up the chariot! Go down so that the downpour may not detain you!’”
18-45|1 Kings|Meanwhile, the sky grew dark with clouds, the wind blew, and a heavy downpour fell; and Aʹhab kept riding and made his way to Jezʹre·el.
18-46|1 Kings|But the hand of Jehovah came on E·liʹjah, and he wrapped his garment around his hips and ran ahead of Aʹhab all the way to Jezʹre·el.
19-01|1 Kings|Then Aʹhab told Jezʹe·bel all that E·liʹjah had done and how he had killed all the prophets with the sword.
19-02|1 Kings|At that Jezʹe·bel sent a messenger to E·liʹjah, saying: “So may the gods do to me and add to it if by this time tomorrow I do not make you like each one of them!”
19-03|1 Kings|At that he became afraid, so he got up and ran for his life. He came to Beʹer-sheʹba, which belongs to Judah, and he left his attendant there.
19-04|1 Kings|He went a day’s journey into the wilderness and came and sat down under a broom tree, and he asked that he might die. He said: “It is enough! Now, O Jehovah, take my life away, for I am no better than my forefathers.”
19-05|1 Kings|Then he lay down and fell asleep under the broom tree. But suddenly an angel touched him and said to him: “Get up and eat.”
19-06|1 Kings|When he looked, there at his head was a round loaf on heated stones and a jug of water. He ate and drank and lay down again.
19-07|1 Kings|Later the angel of Jehovah came back a second time and touched him and said: “Get up and eat, for the journey will be too much for you.”
19-08|1 Kings|So he got up and ate and drank, and in the strength of that nourishment he went on for 40 days and 40 nights until he reached Horʹeb, the mountain of the true God.
19-09|1 Kings|There he entered a cave and spent the night; and look! Jehovah’s word came to him, telling him: “What are you doing here, E·liʹjah?”
19-10|1 Kings|To this he said: “I have been absolutely zealous for Jehovah the God of armies; for the people of Israel have forsaken your covenant, your altars they have torn down, and your prophets they have killed with the sword, and I am the only one left. Now they are seeking to take my life away.” 11 But He said: “Go out and stand on the mountain before Jehovah.” And look! Jehovah was passing by, and a great and strong wind was splitting mountains and breaking crags before Jehovah, but Jehovah was not in the wind. After the wind, there was an earthquake, but Jehovah was not in the earthquake.
19-12|1 Kings|After the earthquake, there was a fire, but Jehovah was not in the fire. After the fire, there was a calm, low voice.
19-13|1 Kings|As soon as E·liʹjah heard it, he wrapped his face in his official garment and went out and stood at the entrance of the cave. Then a voice asked him: “What are you doing here, E·liʹjah?”
19-14|1 Kings|To this he said: “I have been absolutely zealous for Jehovah the God of armies; for the people of Israel have forsaken your covenant, your altars they have torn down, and your prophets they have killed with the sword, and I am the only one left. Now they are seeking to take my life away.”
19-15|1 Kings|Jehovah said to him: “Return, and go to the wilderness of Damascus. When you arrive, anoint Hazʹa·el as king over Syria.
19-16|1 Kings|And you should anoint Jeʹhu the grandson of Nimʹshi as king over Israel, and you should anoint E·liʹsha the son of Shaʹphat from Aʹbel-me·hoʹlah as prophet to take your place.
19-17|1 Kings|Anyone escaping from Hazʹa·el’s sword, Jeʹhu will put to death; and anyone escaping from Jeʹhu’s sword, E·liʹsha will put to death.
19-18|1 Kings|And I still have left 7,000 in Israel, all whose knees have not bent down to Baʹal and whose mouths have not kissed him.”
19-19|1 Kings|So he went from there and found E·liʹsha the son of Shaʹphat while he was plowing with 12 pairs of bulls ahead of him, and he was with the 12th pair. So E·liʹjah went over to him and threw his official garment on him.
19-20|1 Kings|At that he left the bulls and ran after E·liʹjah and said: “Please, let me kiss my father and my mother. Then I will follow you.” He replied to him: “Go, return, for what have I done to stop you?”
19-21|1 Kings|So he went back and took a pair of bulls and sacrificed them, and he used the plowing gear to boil the meat of the bulls and gave it to the people, and they ate. After that he rose up and followed E·liʹjah and began to minister to him.
20-01|1 Kings|Now King Ben-haʹdad of Syria gathered his whole army together along with 32 other kings and their horses and chariots; he went up and laid siege to Sa·marʹi·a and fought against it.
20-02|1 Kings|Then he sent messengers to King Aʹhab of Israel at the city and said to him: “This is what Ben-haʹdad says,
20-03|1 Kings|‘Your silver and your gold are mine, as well as the best of your wives and your sons.’”
20-04|1 Kings|To this the king of Israel answered: “According to your word, my lord the king, I am yours along with all that belongs to me.”
20-05|1 Kings|The messengers later came back and said: “This is what Ben-haʹdad says, ‘I sent this message to you: “Your silver, your gold, your wives, and your sons you will give me.”
20-06|1 Kings|But about this time tomorrow I will send my servants to you, and they will carefully search your house and the houses of your servants, and all your desirable things they will seize and take away.’”
20-07|1 Kings|At that the king of Israel called all the elders of the land and said: “Take note, please, and see that this man is bent on bringing calamity, for he demanded my wives, my sons, my silver, and my gold, and I did not refuse him.”
20-08|1 Kings|Then all the elders and all the people said to him: “Do not obey, and do not consent.”
20-09|1 Kings|So he said to the messengers of Ben-haʹdad: “Say to my lord the king, ‘All that you first demanded of your servant I will do, but this I cannot do.’” With that the messengers went off and brought word back to him.
20-10|1 Kings|Ben-haʹdad now sent him this message: “So may the gods do to me and add to it if there is enough dust in Sa·marʹi·a to give each of the people following me a handful!”
20-11|1 Kings|The king of Israel answered: “Tell him, ‘The one who puts on his armor should not boast about himself like one who takes it off.’”
20-12|1 Kings|As soon as he heard this reply, while he and the kings were drinking in their tents, he said to his servants: “Get ready to attack!” So they got ready to attack the city.
20-13|1 Kings|But a prophet approached King Aʹhab of Israel and said: “This is what Jehovah says, ‘Have you seen all this large crowd? Here I am giving it into your hand today, and then you will know that I am Jehovah.’”
20-14|1 Kings|Aʹhab asked: “By whom?” to which he said: “This is what Jehovah says, ‘By the attendants of the princes of the provinces.’” So he asked: “Who will start the battle?” to which he said: “You!”
20-15|1 Kings|Aʹhab then counted the attendants of the princes of the provinces, and they were 232; after that, he counted all the Israelite men, 7,000.
20-16|1 Kings|They went out at noon while Ben-haʹdad was drinking himself drunk in the tents along with the 32 kings who were helping him.
20-17|1 Kings|When the attendants of the princes of the provinces came out first, Ben-haʹdad at once sent messengers. They reported to him: “Men have come out from Sa·marʹi·a.”
20-18|1 Kings|At that he said: “If they have come out for peace, take them alive; or if they have come out for battle, you should still take them alive.”
20-19|1 Kings|But when these came out of the city—the attendants of the princes of the provinces and the armies that were following them—
20-20|1 Kings|each one struck down his opponent. Then the Syrians fled, and Israel pursued them, but King Ben-haʹdad of Syria escaped on a horse with some of the horsemen.
20-21|1 Kings|But the king of Israel went out and kept striking down the horses and the chariots, and he inflicted a great defeat on the Syrians.
20-22|1 Kings|Later the prophet approached the king of Israel and said to him: “Go, strengthen yourself and consider what you are going to do, for at the start of the next year the king of Syria will come up against you.”
20-23|1 Kings|Now the servants of the king of Syria said to him: “Their God is a God of mountains. That is why they overpowered us. But if we fight against them on level land, we will overpower them.
20-24|1 Kings|Also do this: Remove all the kings from their places, and replace them with governors.
20-25|1 Kings|Then gather an army equal to the army you lost, horse for horse and chariot for chariot. Let us fight against them on level land, and we will surely overpower them.” So he listened to their advice and did just that.
20-26|1 Kings|At the start of the year, Ben-haʹdad mustered the Syrians and went up to Aʹphek for battle against Israel.
20-27|1 Kings|The people of Israel were also mustered and supplied, and they went out to meet them. When the people of Israel camped in front of them, they were like two tiny flocks of goats, while the Syrians filled the whole land.
20-28|1 Kings|Then the man of the true God approached the king of Israel and said: “This is what Jehovah says, ‘Because the Syrians have said: “Jehovah is a God of mountains, and he is not a God of plains,” I will give all this large crowd into your hand, and you will certainly know that I am Jehovah.’”
20-29|1 Kings|They remained encamped opposite each other for seven days, and on the seventh day the battle began. The people of Israel struck down 100,000 Syrian foot soldiers in one day.
20-30|1 Kings|And the rest fled to Aʹphek, into the city. But the wall fell down on 27,000 of the men who were left. Ben-haʹdad also fled and came into the city, and he hid in an inner room.
20-31|1 Kings|So his servants said to him: “Look, we have heard that the kings of the house of Israel are merciful kings. Please, let us wear sackcloth on our hips and put ropes on our heads and go out to the king of Israel. Perhaps he will spare your life.”
20-32|1 Kings|So they wore sackcloth around their hips and ropes on their heads and came in to the king of Israel and said: “Your servant Ben-haʹdad says, ‘Please, let me live.’” He replied: “Is he still alive? He is my brother.”
20-33|1 Kings|The men took it as an omen and quickly took him at his word, so they said: “Ben-haʹdad is your brother.” At that he said: “Go and get him.” Then Ben-haʹdad went out to him, and he had him get up into the chariot.
20-34|1 Kings|Ben-haʹdad now said to him: “The cities that my father took from your father I will return, and you may establish markets for yourself in Damascus, just as my father did in Sa·marʹi·a.” Aʹhab replied: “On the basis of this agreement, I will let you go.” With that he made an agreement with him and let him go.
20-35|1 Kings|By the word of Jehovah, one of the sons of the prophets said to his companion: “Strike me, please.” But the man refused to strike him.
20-36|1 Kings|So he said to him: “Because you did not listen to the voice of Jehovah, as soon as you leave me, a lion will kill you.” After he left him, a lion came upon him and killed him.
20-37|1 Kings|He found another man and said: “Strike me, please.” So the man struck him and wounded him.
20-38|1 Kings|Then the prophet went and waited for the king by the road, disguising himself with a bandage over his eyes.
20-39|1 Kings|As the king was passing by, he cried out to the king: “Your servant went into the thick of the battle, and there was a man coming out who brought a man to me and said, ‘Guard this man. If he is found missing, your life will have to take the place of his life, or else you will pay a talent of silver.’
20-40|1 Kings|And while your servant was busy here and there, suddenly the man was gone.” The king of Israel said to him: “So your own judgment will be; you have decided it yourself.”
20-41|1 Kings|Then he quickly removed the bandage from his eyes, and the king of Israel recognized that he was one of the prophets.
20-42|1 Kings|He said to him: “This is what Jehovah says, ‘Because you have let the man whom I said should be destroyed escape from your hand, your life must take the place of his life, and your people the place of his people.’”
20-43|1 Kings|At that the king of Israel went home to Sa·marʹi·a, sullen and dejected.ooked, there at his head was a round loaf on heated stones and a jug of water. He ate and drank and lay down again.
02-01|Ezra|And these were the people of the province who came up from the captives of the exile, those whom King Neb·u·chad·nezʹzar of Babylon had exiled to Babylon and who later returned to Jerusalem and Judah, each to his own city,
02-02|Ezra|those who came with Ze·rubʹba·bel, Jeshʹu·a, Ne·he·miʹah, Se·raiʹah, Re·el·aiʹah, Morʹde·cai, Bilʹshan, Misʹpar, Bigʹvai, Reʹhum, and Baʹa·nah.The number of the Israelite men included:
02-03|Ezra|the sons of Paʹrosh, 2,172;
02-04|Ezra|the sons of Sheph·a·tiʹah, 372;
02-05|Ezra|the sons of Aʹrah, 775;
02-06|Ezra|the sons of Paʹhath-moʹab, of the sons of Jeshʹu·a and Joʹab, 2,812;
02-07|Ezra|the sons of Eʹlam, 1,254;
02-08|Ezra|the sons of Zatʹtu, 945;
02-09|Ezra|the sons of Zacʹcai, 760;
02-10|Ezra|the sons of Baʹni, 642;
02-11|Ezra|the sons of Beʹbai, 623;
02-12|Ezra|the sons of Azʹgad, 1,222;
02-13|Ezra|the sons of Ad·o·niʹkam, 666;
02-14|Ezra|the sons of Bigʹvai, 2,056;
02-15|Ezra|the sons of Aʹdin, 454;
02-16|Ezra|the sons of Aʹter, of Hez·e·kiʹah, 98;
02-17|Ezra|the sons of Beʹzai, 323;
02-18|Ezra|the sons of Joʹrah, 112;
02-19|Ezra|the sons of Haʹshum, 223;
02-20|Ezra|the sons of Gibʹbar, 95;
02-21|Ezra|the sons of Bethʹle·hem, 123;
02-22|Ezra|the men of Ne·toʹphah, 56;
02-23|Ezra|the men of Anʹa·thoth, 128;
02-24|Ezra|the sons of Azʹma·veth, 42;
02-25|Ezra|the sons of Kirʹi·ath-jeʹa·rim, Che·phiʹrah, and Be·erʹoth, 743;
02-26|Ezra|the sons of Raʹmah and Geʹba, 621;
02-27|Ezra|the men of Michʹmas, 122;
02-28|Ezra|the men of Bethʹel and Aʹi, 223;
02-29|Ezra|the sons of Neʹbo, 52;
02-30|Ezra|the sons of Magʹbish, 156;
02-31|Ezra|the sons of the other Eʹlam, 1,254;
02-32|Ezra|the sons of Haʹrim, 320;
02-33|Ezra|the sons of Lod, Haʹdid, and Oʹno, 725;
02-34|Ezra|the sons of Jerʹi·cho, 345;
02-35|Ezra|the sons of Se·naʹah, 3,630.
02-36|Ezra|The priests: the sons of Je·daʹiah of the house of Jeshʹu·a, 973;
02-37|Ezra|the sons of Imʹmer, 1,052;
02-38|Ezra|the sons of Pashʹhur, 1,247;
02-39|Ezra|the sons of Haʹrim, 1,017.
02-40|Ezra|The Levites: the sons of Jeshʹu·a and Kadʹmi·el, of the sons of Hod·a·viʹah, 74.
02-41|Ezra|The singers: the sons of Aʹsaph, 128.
02-42|Ezra|The sons of the gatekeepers: the sons of Shalʹlum, the sons of Aʹter, the sons of Talʹmon, the sons of Akʹkub, the sons of Ha·tiʹta, the sons of Shoʹbai, altogether 139.
