verse|book|quote
15-36|Joshua|Shaʹa·raʹim, Ad·i·thaʹim, and Ge·deʹrah and Ged·e·ro·thaʹim—14 cities and their settlements.
15-37|Joshua|Zeʹnan, Ha·dashʹah, Migʹdal-gad,
15-38|Joshua|Diʹle·an, Mizʹpeh, Jokʹthe·el,
15-39|Joshua|Laʹchish, Bozʹkath, Egʹlon,
15-40|Joshua|Cabʹbon, Lahʹmam, Chitʹlish,
15-41|Joshua|Ge·deʹroth, Beth-daʹgon, Naʹa·mah, and Mak·keʹdah—16 cities and their settlements.
15-42|Joshua|Libʹnah, Eʹther, Aʹshan,
15-43|Joshua|Iphʹtah, Ashʹnah, Neʹzib,
15-44|Joshua|Keiʹlah, Achʹzib, and Ma·reʹshah—nine cities and their settlements.
15-45|Joshua|Ekʹron and its dependent towns and its settlements;
15-46|Joshua|from Ekʹron westward, all that is alongside Ashʹdod and their settlements.
15-47|Joshua|Ashʹdod, its dependent towns and its settlements; Gazʹa, its dependent towns and its settlements, down to the Wadi of Egypt, the Great Sea, and the adjacent region.
15-48|Joshua|And in the mountainous region, Shaʹmir, Jatʹtir, Soʹcoh,
15-49|Joshua|Danʹnah, Kirʹi·ath-sanʹnah, that is, Deʹbir,
15-50|Joshua|Aʹnab, Eshʹte·moh, Aʹnim,
15-51|Joshua|Goʹshen, Hoʹlon, and Giʹloh—11 cities and their settlements.
15-52|Joshua|Arab, Duʹmah, Eʹshan,
15-53|Joshua|Jaʹnim, Beth-tapʹpu·ah, A·pheʹkah,
15-54|Joshua|Humʹtah, Kirʹi·ath-arʹba, that is, Hebʹron, and Ziʹor—nine cities and their settlements.
15-55|Joshua|Maʹon, Carʹmel, Ziph, Jutʹtah,
15-56|Joshua|Jezʹre·el, Jokʹde·am, Za·noʹah,
15-57|Joshua|Kaʹin, Gibʹe·ah, and Timʹnah—ten cities and their settlements.
15-58|Joshua|Halʹhul, Beth-zur, Geʹdor,
15-59|Joshua|Maʹa·rath, Beth-aʹnoth, and Elʹte·kon—six cities and their settlements.
19-01|Joshua|Then the second lot came out for Simʹe·on, for the tribe of Simʹe·on by their families. And their inheritance was within the inheritance of Judah.
19-02|Joshua|Their inheritance was Beʹer-sheʹba with Sheʹba, Mo·laʹdah,
19-03|Joshua|Haʹzar-shuʹal, Baʹlah, Eʹzem,
19-04|Joshua|El·toʹlad, Beʹthul, Horʹmah,
19-05|Joshua|Zikʹlag, Beth-marʹca·both, Haʹzar-suʹsah,
19-06|Joshua|Beth-le·baʹoth, and Sha·ruʹhen—13 cities and their settlements;
19-07|Joshua|Aʹin, Rimʹmon, Eʹther, and Aʹshan—four cities and their settlements;
19-08|Joshua|and all the settlements that were around these cities as far as Baʹal·ath-beʹer, Raʹmah of the south. This was the inheritance of the tribe of Simʹe·on by their families.
19-09|Joshua|The inheritance of the descendants of Simʹe·on was taken out of the allotment of Judah, because the share of Judah was too large for them. So the descendants of Simʹe·on received a possession within their inheritance.
19-10|Joshua|Next the third lot came up for the descendants of Zebʹu·lun by their families, and the boundary of their inheritance went as far as Saʹrid. 
19-11|Joshua|Their boundary went up westward to Marʹe·al and reached to Dabʹbe·sheth and then to the valley in front of Jokʹne·am. 
19-12|Joshua|And it went from Saʹrid eastward toward the sunrise, to the border of Chisʹloth-taʹbor and out to Dabʹe·rath and then up to Ja·phiʹa. 
19-13|Joshua|And from there it continued eastward toward the sunrise to Gath-heʹpher, to Eth-kaʹzin, and out to Rimʹmon, and it extended to Neʹah. 
19-14|Joshua|And the boundary went around it on the north to Hanʹna·thon, and it ended at the Valley of Iphʹtah-el, 
19-15|Joshua|and Katʹtath, Na·halʹal, Shimʹron, Iʹda·lah, and Bethʹle·hem—12 cities and their settlements. 
19-16|Joshua|This was the inheritance of the descendants of Zebʹu·lun by their families. These were the cities and their settlements.
19-17|Joshua|The fourth lot came out for Isʹsa·char, for the descendants of Isʹsa·char by their families. 
19-18|Joshua|And their boundary was to Jezʹre·el, Che·sulʹloth, Shuʹnem, 
19-19|Joshua|Haphʹa·raʹim, Shiʹon, An·a·haʹrath, 
19-20|Joshua|Rabʹbith, Kishʹi·on, Eʹbez, 
19-21|Joshua|Reʹmeth, En-ganʹnim, En-hadʹdah, and Beth-pazʹzez. 
19-22|Joshua|And the boundary reached to Taʹbor and Sha·ha·zuʹmah and Beth-sheʹmesh, and the end of their border was at the Jordan—16 cities and their settlements. 
19-23|Joshua|This was the inheritance of the tribe of Isʹsa·char by their families, the cities and their settlements.
19-24|Joshua|Then the fifth lot came out for the tribe of Ashʹer by their families. 
19-25|Joshua|And their boundary was Helʹkath, Haʹli, Beʹten, Achʹshaph, 
19-26|Joshua|Al·lamʹme·lech, Aʹmad, and Miʹshal. It reached westward to Carʹmel and to Shiʹhor-libʹnath, 
19-27|Joshua|and it went back toward the east to Beth-daʹgon and reached to Zebʹu·lun and the Valley of Iphʹtah-el to the north, to Beth-eʹmek and Ne·iʹel, and it extended to Caʹbul on the left, 
19-28|Joshua|and to Eʹbron, Reʹhob, Hamʹmon, and Kaʹnah as far as Great Siʹdon. 
19-29|Joshua|And the boundary went back to Raʹmah and as far as the fortified city of Tyre. Then the boundary went back to Hoʹsah, and it ended at the sea in the region of Achʹzib, 
19-30|Joshua|Umʹmah, Aʹphek, and Reʹhob—22 cities and their settlements. 
19-31|Joshua|This was the inheritance of the tribe of Ashʹer by their families. These were the cities and their settlements.
19-32|Joshua|The sixth lot came out for the descendants of Naphʹta·li, for the descendants of Naphʹta·li by their families. 
19-33|Joshua|Their boundary was from Heʹleph, from the big tree in Za·a·nanʹnim, and Adʹa·mi-neʹkeb and Jabʹne·el as far as Lakʹkum; and it ended at the Jordan. 
19-34|Joshua|The boundary went back westward to Azʹnoth-taʹbor and extended from there to Hukʹkok and reached to Zebʹu·lun on the south and to Ashʹer on the west and to Judah at the Jordan toward the east. 
19-35|Joshua|And the fortified cities were Zidʹdim, Zer, Hamʹmath, Rakʹkath, Chinʹne·reth, 
19-36|Joshua|Adʹa·mah, Raʹmah, Haʹzor, 
19-37|Joshua|Keʹdesh, Edʹre·i, En-haʹzor, 
19-38|Joshua|Yiʹron, Migʹdal-el, Hoʹrem, Beth-aʹnath, and Beth-sheʹmesh—19 cities and their settlements. 
19-39|Joshua|This was the inheritance of the tribe of Naphʹta·li by their families, the cities and their settlements.
19-40|Joshua|The seventh lot came out for the tribe of Dan by their families. 
19-41|Joshua|And the border of their inheritance was Zoʹrah, Eshʹta·ol, Ir-sheʹmesh, 
19-42|Joshua|Sha·al·abʹbin, Aiʹja·lon, Ithʹlah, 
19-43|Joshua|Eʹlon, Timʹnah, Ekʹron, 
19-44|Joshua|Elʹte·keh, Gibʹbe·thon, Baʹal·ath, 
19-45|Joshua|Jeʹhud, Benʹe-beʹrak, Gath-rimʹmon, 
19-46|Joshua|Me-jarʹkon, and Rakʹkon, with the border facing Jopʹpa. 
19-47|Joshua|But the territory of Dan was too cramped for them. So they went up and fought against Leʹshem and captured it and struck it with the sword. Then they took possession of it and settled in it, and they changed the name of Leʹshem to Dan, after the name of Dan their forefather. 
19-48|Joshua|This was the inheritance of the tribe of Dan by their families. These were the cities and their settlements.
19-49|Joshua|Thus they finished dividing the land for inheritance by its territories. Then the Israelites gave Joshua the son of Nun an inheritance in their midst. 
19-50|Joshua|At the order of Jehovah they gave him the city he asked for, Timʹnath-seʹrah, in the mountainous region of Eʹphra·im, and he built up the city and settled in it.
19-51|Joshua|These were the inheritances that El·e·aʹzar the priest, Joshua the son of Nun, and the heads of the paternal houses of the tribes of Israel distributed by lot in Shiʹloh before Jehovah, at the entrance of the tent of meeting. So they finished apportioning the land.
15-01|1 Chronicles|And he continued building houses for himself in the City of David, and he prepared a place for the Ark of the true God and pitched a tent for it.
15-02|1 Chronicles|It was then that David said: “No one is to carry the Ark of the true God except the Levites, for Jehovah has chosen them to carry the Ark of Jehovah and to minister to him always.”
15-03|1 Chronicles|Then David congregated all Israel at Jerusalem to bring the Ark of Jehovah up to the place that he had prepared for it.
15-04|1 Chronicles|David gathered the descendants of Aaron and the Levites: 5 from the Koʹhath·ites, U·riʹel the chief and 120 of his brothers;
15-06|1 Chronicles|from the Me·rarʹites, A·saiʹah the chief and 220 of his brothers;
15-07|1 Chronicles|from the Gerʹshom·ites, Joel the chief and 130 of his brothers;
15-08|1 Chronicles|from the descendants of E·li·zaʹphan, She·maiʹah the chief and 200 of his brothers;
15-09|1 Chronicles|from the descendants of Hebʹron, Eʹli·el the chief and 80 of his brothers;
15-10|1 Chronicles|from the descendants of Uzʹzi·el, Am·minʹa·dab the chief and 112 of his brothers.
15-11|1 Chronicles|Furthermore, David called the priests Zaʹdok and A·biʹa·thar and the Levites U·riʹel, A·saiʹah, Joel, She·maiʹah, Eʹli·el, and Am·minʹa·dab,
15-12|1 Chronicles|and he said to them: “You are the heads of the paternal houses of the Levites. Sanctify yourselves, you and your brothers, and bring the Ark of Jehovah the God of Israel up to the place that I have prepared for it.
15-13|1 Chronicles|Since you did not carry it the first time, the anger of Jehovah our God broke out against us, because we did not search out the proper procedure.”
15-14|1 Chronicles|So the priests and the Levites sanctified themselves to bring up the Ark of Jehovah the God of Israel.
15-15|1 Chronicles|Then the Levites carried the Ark of the true God on their shoulders with the poles, just as Moses had commanded by Jehovah’s word.
15-16|1 Chronicles|David then told the chiefs of the Levites to appoint their brothers the singers to sing out joyfully, accompanied by musical instruments: stringed instruments, harps, and cymbals.
15-17|1 Chronicles|So the Levites appointed Heʹman the son of Joel and, of his brothers, Aʹsaph the son of Ber·e·chiʹah and, of the Me·rarʹites their brothers, Eʹthan the son of Kush·aʹiah.
15-18|1 Chronicles|Together with them were their brothers of the second division, Zech·a·riʹah, Ben, Ja·aʹzi·el, She·mirʹa·moth, Je·hiʹel, Unʹni, E·liʹab, Be·naiʹah, Ma·a·seiʹah, Mat·ti·thiʹah, E·liphʹe·le·hu, and Mik·neʹiah and Oʹbed-eʹdom and Je·iʹel the gatekeepers.
15-19|1 Chronicles|The singers Heʹman, Aʹsaph, and Eʹthan were to play the copper cymbals;
15-20|1 Chronicles|and Zech·a·riʹah, Aʹzi·el, She·mirʹa·moth, Je·hiʹel, Unʹni, E·liʹab, Ma·a·seiʹah, and Be·naiʹah played stringed instruments tuned to Alʹa·moth;
15-21|1 Chronicles|and Mat·ti·thiʹah, E·liphʹe·le·hu, Mik·neʹiah, Oʹbed-eʹdom, Je·iʹel, and Az·a·ziʹah played harps tuned to Shemʹi·nith, to act as directors.
15-22|1 Chronicles|Chen·a·niʹah the chief of the Levites supervised the transport, for he was an expert,
15-23|1 Chronicles|and Ber·e·chiʹah and El·kaʹnah were gatekeepers for the Ark.
15-24|1 Chronicles|The priests Sheb·a·niʹah, Joshʹa·phat, Ne·thanʹel, A·maʹsai, Zech·a·riʹah, Be·naiʹah, and E·li·eʹzer loudly sounded the trumpets before the Ark of the true God, and Oʹbed-eʹdom and Je·hiʹah also served as gatekeepers for the Ark.
15-25|1 Chronicles|Then David and the elders of Israel and the chiefs of the thousands were walking along to bring the ark of the covenant of Jehovah up from the house of Oʹbed-eʹdom with rejoicing.
15-26|1 Chronicles|When the true God helped the Levites who were carrying the ark of the covenant of Jehovah, they sacrificed seven young bulls and seven rams.
15-27|1 Chronicles|David was dressed in a sleeveless coat of fine fabric, as were all the Levites carrying the Ark, the singers, and Chen·a·niʹah the chief of the transport and the singers; David was also wearing a linen ephʹod.
15-28|1 Chronicles|All the Israelites were bringing up the ark of the covenant of Jehovah with joyful shouting, with the sound of the horn, with trumpets, with cymbals, playing loudly on stringed instruments and harps.
15-29|1 Chronicles|But when the ark of the covenant of Jehovah came to the City of David, Saul’s daughter Miʹchal looked down through the window and saw King David skipping about and celebrating; and she began to despise him in her heart.
00-01|Obadiah|The vision of O·ba·diʹah: This is what the Sovereign Lord Jehovah says regarding Eʹdom: “We have heard a report from Jehovah, An envoy has been sent among the nations: ‘Rise up, let us prepare for battle against her.’” 
00-02|Obadiah|“Look! I have made you insignificant among the nations; You are utterly despised.
00-03|Obadiah|The presumptuousness of your heart has deceived you, You who reside in the retreats of the crag, Dwelling in the height, saying in your heart, ‘Who will bring me down to the earth?’
00-04|Obadiah|Even if you make your dwelling high like the eagle, Or if you place your nest among the stars, I would bring you down from there,” declares Jehovah.
00-05|Obadiah|“If thieves would come to you, robbers by night, (How utterly you will be destroyed!) Would they not steal only what they wanted? Or if it were grape gatherers who would come to you, Would they not leave some gleanings behind?
00-06|Obadiah|O how Eʹsau has been searched out! How his hidden treasures have been sought after!
00-07|Obadiah|They have driven you to the border. All your allies have deceived you. The men at peace with you have prevailed against you. Those eating bread with you will place a net under you, But you will not discern it.
00-08|Obadiah|In that day,” declares Jehovah, “Will I not destroy the wise ones out of Eʹdom And discernment out of the mountainous region of Eʹsau?
00-09|Obadiah|And your warriors will become terrified, O Teʹman, Because each one in the mountainous region of Eʹsau will be destroyed in the slaughter.
00-10|Obadiah|Because of the violence done to your brother Jacob, Shame will cover you, And you will perish forever.
00-11|Obadiah|On the day when you stood off to the side, On the day when strangers took his army into captivity, When foreigners entered his gate and cast lots over Jerusalem, You acted like one of them.
00-12|Obadiah|You should not gloat over your brother’s day on the day of his misfortune, You should not rejoice over the people of Judah on the day of their perishing, And you should not speak so arrogantly on the day of their distress.
00-13|Obadiah|You should not come into the gate of my people in the day of their disaster, You should not gloat over his calamity in the day of his disaster, And you should not lay your hands on his wealth in the day of his disaster.
00-14|Obadiah|You should not stand at the crossroads to slaughter his escapees, And you should not hand over his survivors in the day of distress.
00-15|Obadiah|For the day of Jehovah against all the nations is near. As you have done, so it will be done to you. The way you treated others will come back on your own head.
00-16|Obadiah|For in the way that you have drunk on my holy mountain, All the nations will keep drinking constantly. They will drink and gulp down, And they will be as though they had never existed.
00-17|Obadiah|But on Mount Zion will be those who escape, And it will be holy; And the house of Jacob will take possession of the things belonging to them.
00-18|Obadiah|The house of Jacob will become a fire, The house of Joseph a flame, And the house of Eʹsau like stubble; They will set them ablaze and consume them, And there will be no survivor of the house of Eʹsau, For Jehovah himself has spoken.
00-19|Obadiah|They will take possession of the Negʹeb and the mountainous region of Eʹsau, Of the She·pheʹlah and the land of the Phi·lisʹtines. They will take possession of the field of Eʹphra·im and the field of Sa·marʹi·a, And Benjamin will take possession of Gilʹe·ad.
00-20|Obadiah|To the exiles of this rampart, To the people of Israel will belong the land of the Caʹnaan·ites as far as Zarʹe·phath. And the exiles of Jerusalem, who were in Se·pharʹad, will possess the cities of the Negʹeb.
00-21|Obadiah|And saviors will go up on Mount Zion To judge the mountainous region of Eʹsau, And the kingship will become Jehovah’s.”
09-01|Judges|In time A·bimʹe·lech the son of Jer·ub·baʹal went to his mother’s brothers in Sheʹchem, and he said to them and to all the family of his grandfather:
09-02|Judges|“Please ask all the leaders of Sheʹchem, ‘Which is better for you, for all 70 sons of Jer·ub·baʹal to rule over you or for one man to rule over you? And remember that I am your own bone and flesh.’”
09-03|Judges|So his mother’s brothers said this in his behalf to all the leaders of Sheʹchem, and their hearts were inclined to follow A·bimʹe·lech, for they said: “He is our own brother.”
09-04|Judges|Then they gave him 70 pieces of silver from the house of Baʹal-beʹrith, and A·bimʹe·lech used it to hire idle and insolent men to accompany him.
09-05|Judges|After that he went to his father’s house at Ophʹrah and killed his brothers, the sons of Jer·ub·baʹal, 70 men, on one stone. The only survivor was Joʹtham, the youngest son of Jer·ub·baʹal, because he hid.
09-06|Judges|Then all the leaders of Sheʹchem and all Beth-milʹlo gathered together and made A·bimʹe·lech king, close by the big tree, by the pillar that was in Sheʹchem.
09-07|Judges|When they reported it to Joʹtham, he at once went and stood on the top of Mount Gerʹi·zim and called out in a loud voice to them: “Listen to me, you leaders of Sheʹchem, and then God will listen to you.
09-08|Judges|“Once there were trees that went to anoint a king over them. So they said to the olive tree, ‘Rule over us.’
09-09|Judges|But the olive tree said to them, ‘Must I give up my oil, which they use to glorify God and men, to go and wave over the other trees?’
09-10|Judges|Then the trees said to the fig tree, ‘Come and rule over us.’
09-11|Judges|But the fig tree said to them, ‘Must I give up my sweetness and my good fruitage to go and wave over the other trees?’
09-12|Judges|Next the trees said to the vine, ‘Come and rule over us.’
09-13|Judges|The vine replied to them, ‘Must I give up my new wine that makes God and men rejoice to go and wave over the trees?’
09-14|Judges|Finally all the other trees said to the bramble, ‘Come and rule over us.’
09-15|Judges|At this the bramble said to the trees, ‘If you are really anointing me as king over you, come and seek refuge under my shadow. But if not, let fire come out of the bramble and consume the cedars of Lebʹa·non.’
09-16|Judges|“Now have you acted sincerely and honorably in making A·bimʹe·lech king, and have you shown goodness toward Jer·ub·baʹal and his household, and have you treated him as he deserves?
09-17|Judges|When my father fought for you, he risked his life to save you from Midʹi·an’s hand.
09-18|Judges|But today you have risen up against my father’s household and killed his sons, 70 men, on one stone. Then you made A·bimʹe·lech, the son of his slave girl, king over the leaders of Sheʹchem just because he is your brother.
09-19|Judges|Yes, if you are acting sincerely and honorably toward Jer·ub·baʹal and his household this day, rejoice over A·bimʹe·lech and let him also rejoice over you.
09-20|Judges|But if not, may fire come out of A·bimʹe·lech and consume the leaders of Sheʹchem and Beth-milʹlo, and may fire come out of the leaders of Sheʹchem and Beth-milʹlo and consume A·bimʹe·lech.”
09-21|Judges|Then Joʹtham fled and escaped to Beʹer, and he lived there because of his brother A·bimʹe·lech.
09-22|Judges|A·bimʹe·lech ruled over Israel for three years.
09-23|Judges|Then God let hostility develop between A·bimʹe·lech and the leaders of Sheʹchem, and they dealt treacherously with A·bimʹe·lech.
09-24|Judges|This was so that the violence done to the 70 sons of Jer·ub·baʹal might be avenged, so as to place responsibility for their blood on their brother A·bimʹe·lech for killing them and on the leaders of Sheʹchem for helping him to kill his brothers.
09-25|Judges|So the leaders of Sheʹchem set men to ambush him on the mountaintops, and they would rob everyone who passed by them on the road. In time it was reported to A·bimʹe·lech.
09-26|Judges|Then Gaʹal son of Eʹbed and his brothers crossed over into Sheʹchem, and the leaders of Sheʹchem put their trust in him.
09-27|Judges|They went out into the field and gathered the grapes of their vineyards, trod them out, and held a festival, after which they went into the house of their god and ate and drank and cursed A·bimʹe·lech.
09-28|Judges|Then Gaʹal the son of Eʹbed said: “Who is A·bimʹe·lech, and who is Sheʹchem that we should serve him? Is he not the son of Jer·ub·baʹal, and is not Zeʹbul his commissioner? Serve the men of Haʹmor, Sheʹchem’s father! But why should we serve him?
09-29|Judges|If only this people were under my command, I would depose A·bimʹe·lech.” Then he said to A·bimʹe·lech: “Increase your army and come out.”
09-30|Judges|When Zeʹbul the prince of the city heard the words of Gaʹal the son of Eʹbed, his anger blazed.
09-31|Judges|So he secretly sent messengers to A·bimʹe·lech, saying: “Look! Gaʹal the son of Eʹbed and his brothers are now in Sheʹchem, and here they are inciting the city against you.
09-32|Judges|Now come up by night, you and your men, and lie in wait in the field.
09-33|Judges|As soon as the sun rises in the morning, you should get up early and attack the city; and when he and his men come out against you, do whatever you can to defeat him.”
09-34|Judges|So A·bimʹe·lech and all the people with him rose up by night, and in four bands they lay in wait against Sheʹchem.
09-35|Judges|When Gaʹal the son of Eʹbed went out and stood at the entrance of the city gate, A·bimʹe·lech and the people with him rose up from the ambush.
09-36|Judges|When Gaʹal saw the people, he said to Zeʹbul: “Look! There are people coming down from the mountaintops.” But Zeʹbul said to him: “You are seeing the shadows of the mountains as if they were men.”
09-37|Judges|Gaʹal later said: “Look! People are coming down from the center of the land, and one band is coming by the way of the big tree of Me·onʹe·nim.”
09-38|Judges|Zeʹbul replied to him: “Where now is your boast, ‘Who is A·bimʹe·lech that we should serve him?’ Are these not the people you rejected? Go out now and fight against them.”
09-39|Judges|So Gaʹal went out at the head of the leaders of Sheʹchem and fought against A·bimʹe·lech.
09-40|Judges|A·bimʹe·lech pursued him, and Gaʹal fled from him, and many fell slain as far as the entrance of the city gate.
09-41|Judges|And A·bimʹe·lech continued to dwell in A·ruʹmah, and Zeʹbul drove Gaʹal and his brothers out of Sheʹchem.
09-42|Judges|The next day the people went out into the field, and A·bimʹe·lech was told about it.
09-43|Judges|So he took the people and divided them into three bands and lay in wait in the field. When he saw the people going out of the city, he attacked them and struck them down.
09-44|Judges|A·bimʹe·lech and the bands with him charged forward and took a position at the entrance of the city gate, while two bands attacked all who were in the field, and they struck them down.
09-45|Judges|A·bimʹe·lech fought against the city all that day and captured it. He killed the people in it, and then he pulled the city down and sowed it with salt.
09-46|Judges|When all the leaders of the tower of Sheʹchem heard about this, they immediately went to the vault of the house of El-beʹrith.
09-47|Judges|As soon as it was reported to A·bimʹe·lech that all the leaders of the tower of Sheʹchem had gathered together,
09-48|Judges|A·bimʹe·lech and all the men with him went up Mount Zalʹmon. A·bimʹe·lech took an ax in his hand and cut off a tree branch and lifted it on his shoulder and said to the people with him: “What you saw me do, hurry and do the same!”
09-49|Judges|So all the people also cut off branches and followed A·bimʹe·lech. Then they put the branches against the vault and set the vault on fire. So all the people of the tower of Sheʹchem also died, about 1,000 men and women.
09-50|Judges|A·bimʹe·lech then went to Theʹbez; he camped against Theʹbez and captured it.
09-51|Judges|There was a strong tower in the middle of the city, and all the men and women and all the city leaders fled there. They shut themselves in and climbed onto the roof of the tower.
09-52|Judges|A·bimʹe·lech made his way to the tower and attacked it. He approached the entrance of the tower to set it on fire.
09-53|Judges|Then one of the women dropped an upper millstone on A·bimʹe·lech’s head and crushed his skull.
09-54|Judges|He quickly called the attendant bearing his weapons and said to him: “Draw your sword and put me to death, so that they may not say about me, ‘A woman killed him.’” So his attendant ran him through, and he died.
09-55|Judges|When the men of Israel saw that A·bimʹe·lech was dead, they all went back home.
09-56|Judges|Thus God repaid A·bimʹe·lech for the evil that he had done to his father by killing his 70 brothers.
09-57|Judges|God also made all the evil of the men of Sheʹchem come back on their own heads. So the curse of Joʹtham the son of Jer·ub·baʹal came upon them.
20-01|Judges|Consequently, all the Israelites came out from Dan down to Beʹer-sheʹba and from the land of Gilʹe·ad, and the entire assembly gathered unitedly before Jehovah at Mizʹpah.
20-02|Judges|So the chiefs of the people and all the tribes of Israel took their places in the congregation of God’s people—400,000 foot soldiers armed with swords.
