verse|book|quote
01-01|Genesis|In the beginning God created the heavens and the earth.
01-02|Genesis|Now the earth was formless and desolate, and there was darkness upon the surface of the watery deep, and God’s active force was moving about over the surface of the waters.
01-03|Genesis|And God said: “Let there be light.” Then there was light.
01-04|Genesis|After that God saw that the light was good, and God began to divide the light from the darkness.
01-05|Genesis|God called the light Day, but the darkness he called Night. And there was evening and there was morning, a first day.
01-06|Genesis|Then God said: “Let there be an expanse between the waters, and let there be a division between the waters and the waters.”
01-07|Genesis|Then God went on to make the expanse and divided the waters beneath the expanse from the waters above the expanse. And it was so.
01-08|Genesis|God called the expanse Heaven. And there was evening and there was morning, a second day.
01-09|Genesis|Then God said: “Let the waters under the heavens be collected together into one place, and let the dry land appear.” And it was so.
01-10|Genesis|God called the dry land Earth, but the collecting of the waters, he called Seas. And God saw that it was good.
01-11|Genesis|Then God said: “Let the earth cause grass to sprout, seed-bearing plants and fruit trees according to their kinds, yielding fruit along with seed on the earth.” And it was so.
01-12|Genesis|And the earth began to produce grass, seed-bearing plants and trees yielding fruit along with seed, according to their kinds. Then God saw that it was good.
01-13|Genesis|And there was evening and there was morning, a third day.
01-14|Genesis|Then God said: “Let there be luminaries in the expanse of the heavens to make a division between the day and the night, and they will serve as signs for seasons and for days and years.
01-15|Genesis|They will serve as luminaries in the expanse of the heavens to shine upon the earth.” And it was so.
01-16|Genesis|And God went on to make the two great luminaries, the greater luminary for dominating the day and the lesser luminary for dominating the night, and also the stars.
01-17|Genesis|Thus God put them in the expanse of the heavens to shine upon the earth
01-18|Genesis|and to dominate by day and by night and to make a division between the light and the darkness. Then God saw that it was good.
01-19|Genesis|And there was evening and there was morning, a fourth day.
01-20|Genesis|Then God said: “Let the waters swarm with living creatures, and let flying creatures fly above the earth across the expanse of the heavens.”
01-21|Genesis|And God created the great sea creatures and all living creatures that move and swarm in the waters according to their kinds and every winged flying creature according to its kind. And God saw that it was good.
01-22|Genesis|With that God blessed them, saying: “Be fruitful and become many and fill the waters of the sea, and let the flying creatures become many in the earth.”
01-23|Genesis|And there was evening and there was morning, a fifth day.
01-24|Genesis|Then God said: “Let the earth bring forth living creatures according to their kinds, domestic animals and creeping animals and wild animals of the earth according to their kinds.” And it was so.
01-25|Genesis|And God went on to make the wild animals of the earth according to their kinds and the domestic animals according to their kinds and all the creeping animals of the ground according to their kinds. And God saw that it was good.
01-26|Genesis|Then God said: “Let us make man in our image, according to our likeness, and let them have in subjection the fish of the sea and the flying creatures of the heavens and the domestic animals and all the earth and every creeping animal that is moving on the earth.”
01-27|Genesis|And God went on to create the man in his image, in God’s image he created him; male and female he created them.
01-28|Genesis|Further, God blessed them, and God said to them: “Be fruitful and become many, fill the earth and subdue it, and have in subjection the fish of the sea and the flying creatures of the heavens and every living creature that is moving on the earth.”
01-29|Genesis|Then God said: “Here I have given to you every seed-bearing plant that is on the entire earth and every tree with seed-bearing fruit. Let them serve as food for you.
01-30|Genesis|And to every wild animal of the earth and to every flying creature of the heavens and to everything moving on the earth in which there is life, I have given all green vegetation for food.” And it was so.
01-31|Genesis|After that God saw everything he had made, and look! it was very good. And there was evening and there was morning, a sixth day.
02-01|Genesis|Thus the heavens and the earth and everything in them were completed.
02-02|Genesis|And by the seventh day, God had completed the work that he had been doing, and he began to rest on the seventh day from all his work that he had been doing.
02-03|Genesis|And God went on to bless the seventh day and to declare it sacred, for on it God has been resting from all the work that he has created, all that he purposed to make.
02-04|Genesis|This is a history of the heavens and the earth in the time they were created, in the day that Jehovah God made earth and heaven.
02-05|Genesis|No bush of the field was yet on the earth and no vegetation of the field had begun sprouting, because Jehovah God had not made it rain on the earth and there was no man to cultivate the ground.
02-06|Genesis|But a mist would go up from the earth, and it watered the entire surface of the ground.
02-07|Genesis|And Jehovah God went on to form the man out of dust from the ground and to blow into his nostrils the breath of life, and the man became a living person.
02-08|Genesis|Further, Jehovah God planted a garden in Eʹden, toward the east; and there he put the man whom he had formed.
02-09|Genesis|Thus Jehovah God made to grow out of the ground every tree that was pleasing to look at and good for food and also the tree of life in the middle of the garden and the tree of the knowledge of good and bad.
02-10|Genesis|Now there was a river flowing out of Eʹden to water the garden, and from there it divided into four rivers.
02-11|Genesis|The name of the first is Piʹshon; it is the one encircling the entire land of Havʹi·lah, where there is gold.
02-12|Genesis|The gold of that land is good. Bdellium gum and onyx stone are also there.
02-13|Genesis|The name of the second river is Giʹhon; it is the one encircling the entire land of Cush.
02-14|Genesis|The name of the third river is Hidʹde·kel; it is the one going to the east of As·syrʹi·a. And the fourth river is the Eu·phraʹtes.
02-15|Genesis|Jehovah God took the man and settled him in the garden of Eʹden to cultivate it and to take care of it.
02-16|Genesis|Jehovah God also gave this command to the man: “From every tree of the garden you may eat to satisfaction.
02-17|Genesis|But as for the tree of the knowledge of good and bad, you must not eat from it, for in the day you eat from it you will certainly die.”
02-18|Genesis|Then Jehovah God said: “It is not good for the man to continue to be alone. I am going to make a helper for him, as a complement of him.”
02-19|Genesis|Now Jehovah God had been forming from the ground every wild animal of the field and every flying creature of the heavens, and he began bringing them to the man to see what he would call each one; and whatever the man would call each living creature, that became its name.
02-20|Genesis|So the man named all the domestic animals and the flying creatures of the heavens and every wild animal of the field, but for man there was no helper as a complement of him.
02-21|Genesis|So Jehovah God caused the man to fall into a deep sleep, and while he was sleeping, he took one of his ribs and then closed up the flesh over its place.
02-22|Genesis|And Jehovah God built the rib that he had taken from the man into a woman, and he brought her to the man.
02-23|Genesis|Then the man said: “This is at last bone of my bones And flesh of my flesh. This one will be called Woman, Because from man she was taken.”
02-24|Genesis|That is why a man will leave his father and his mother and he will stick to his wife, and they will become one flesh.
02-25|Genesis|And both of them continued to be naked, the man and his wife; yet they were not ashamed.
03-01|Genesis|Now the serpent was the most cautious of all the wild animals of the field that Jehovah God had made. So it said to the woman: “Did God really say that you must not eat from every tree of the garden?”
03-02|Genesis|At this the woman said to the serpent: “We may eat of the fruit of the trees of the garden.
03-03|Genesis|But God has said about the fruit of the tree that is in the middle of the garden: ‘You must not eat from it, no, you must not touch it; otherwise you will die.’”
03-04|Genesis|At this the serpent said to the woman: “You certainly will not die.
03-05|Genesis|For God knows that in the very day you eat from it, your eyes will be opened and you will be like God, knowing good and bad.”
03-06|Genesis|Consequently, the woman saw that the tree was good for food and that it was something desirable to the eyes, yes, the tree was pleasing to look at. So she began taking of its fruit and eating it. Afterward, she also gave some to her husband when he was with her, and he began eating it.
03-07|Genesis|Then the eyes of both of them were opened, and they realized that they were naked. So they sewed fig leaves together and made loin coverings for themselves.
03-08|Genesis|Later they heard the voice of Jehovah God as he was walking in the garden about the breezy part of the day, and the man and his wife hid from the face of Jehovah God among the trees of the garden.
03-09|Genesis|And Jehovah God kept calling to the man and saying to him: “Where are you?”
03-10|Genesis|Finally he said: “I heard your voice in the garden, but I was afraid because I was naked, so I hid myself.”
03-11|Genesis|At that he said: “Who told you that you were naked? Have you eaten from the tree from which I commanded you not to eat?”
03-12|Genesis|The man said: “The woman whom you gave to be with me, she gave me fruit from the tree, so I ate.”
03-13|Genesis|Jehovah God then said to the woman: “What is this you have done?” The woman replied: “The serpent deceived me, so I ate.”
03-14|Genesis|Then Jehovah God said to the serpent: “Because you have done this, you are the cursed one out of all the domestic animals and out of all the wild animals of the field. On your belly you will go, and you will eat dust all the days of your life.
03-15|Genesis|And I will put enmity between you and the woman and between your offspring and her offspring. He will crush your head, and you will strike him in the heel.”
03-16|Genesis|To the woman he said: “I will greatly increase the pain of your pregnancy; in pain you will give birth to children, and your longing will be for your husband, and he will dominate you.”
03-17|Genesis|And to Adam he said: “Because you listened to your wife’s voice and ate from the tree concerning which I gave you this command, ‘You must not eat from it,’ cursed is the ground on your account. In pain you will eat its produce all the days of your life.
03-18|Genesis|It will grow thorns and thistles for you, and you must eat the vegetation of the field.
03-19|Genesis|In the sweat of your face you will eat bread until you return to the ground, for out of it you were taken. For dust you are and to dust you will return.”
03-20|Genesis|After this Adam named his wife Eve, because she was to become the mother of everyone living.
03-21|Genesis|And Jehovah God made long garments from skins for Adam and for his wife, to clothe them.
03-22|Genesis|Jehovah God then said: “Here the man has become like one of us in knowing good and bad. Now in order that he may not put his hand out and take fruit also from the tree of life and eat and live forever,—”
03-23|Genesis|With that Jehovah God expelled him from the garden of Eʹden to cultivate the ground from which he had been taken. 24 So he drove the man out, and he posted at the east of the garden of Eʹden the cherubs and the flaming blade of a sword that was turning continuously to guard the way to the tree of life.
04-01|Genesis|Now Adam had sexual relations with his wife Eve, and she became pregnant. When she gave birth to Cain, she said: “I have produced a male child with the help of Jehovah.”
04-02|Genesis|Later she again gave birth, to his brother Abel. Abel became a shepherd of the flock, but Cain became a cultivator of the ground.
04-03|Genesis|After some time, Cain brought some fruits of the land as an offering to Jehovah.
04-04|Genesis|But Abel brought some firstlings of his flock, including their fat. While Jehovah looked with favor on Abel and on his offering,
04-05|Genesis|he did not look with any favor on Cain and on his offering. So Cain grew hot with anger and was dejected.
04-06|Genesis|Then Jehovah said to Cain: “Why are you so angry and dejected?
04-07|Genesis|If you turn to doing good, will you not be restored to favor? But if you do not turn to doing good, sin is crouching at the door, and its craving is to dominate you; but will you get the mastery over it?”
04-08|Genesis|After that Cain said to his brother Abel: “Let us go over into the field.” So while they were in the field, Cain assaulted his brother Abel and killed him.
04-09|Genesis|Later on, Jehovah said to Cain: “Where is your brother Abel?” and he said: “I do not know. Am I my brother’s guardian?”
04-10|Genesis|At this He said: “What have you done? Listen! Your brother’s blood is crying out to me from the ground.
04-11|Genesis|And now you are cursed in banishment from the ground that has opened its mouth to receive your brother’s blood from your hand.
04-12|Genesis|When you cultivate the ground, it will not give you back its produce. You will become a wanderer and a fugitive in the earth.”
04-13|Genesis|At this Cain said to Jehovah: “The punishment for my error is too great to bear.
04-14|Genesis|Today you are driving me from the land, and I will be hidden from your face; and I will become a wanderer and a fugitive on the earth, and anyone who finds me will certainly kill me.”
04-15|Genesis|So Jehovah said to him: “For that reason, anyone who kills Cain will suffer vengeance seven times.” So Jehovah set up a sign for Cain in order that no one finding him would strike him.
04-16|Genesis|Then Cain went away from before Jehovah and took up residence in the land of Exile, to the east of Eʹden.
04-17|Genesis|Afterward Cain had sexual relations with his wife, and she became pregnant and gave birth to Eʹnoch. Then he engaged in building a city and named the city after his son Eʹnoch.
04-18|Genesis|Later Iʹrad was born to Eʹnoch. And Iʹrad became father to Me·huʹja·el, and Me·huʹja·el became father to Me·thuʹsha·el, and Me·thuʹsha·el became father to Laʹmech.
04-19|Genesis|Laʹmech took two wives for himself. The name of the first was Aʹdah, and the name of the second was Zilʹlah.
04-20|Genesis|Aʹdah gave birth to Jaʹbal. He was the founder of those who dwell in tents and have livestock.
04-21|Genesis|His brother’s name was Juʹbal. He was the founder of all those who play the harp and the pipe.
04-22|Genesis|Also, Zilʹlah gave birth to Tuʹbal-cain, who forged every sort of tool of copper and iron. And the sister of Tuʹbal-cain was Naʹa·mah.
04-23|Genesis|Then Laʹmech composed these words for his wives Aʹdah and Zilʹlah: “Hear my voice, you wives of Laʹmech; Give ear to my saying: A man I have killed for wounding me, Yes, a young man for striking me.
04-24|Genesis|If 7 times Cain is to be avenged, Then Laʹmech 77 times.”
04-25|Genesis|Adam again had sexual relations with his wife, and she gave birth to a son. She named him Seth because, as she said, “God has appointed for me another offspring in place of Abel, because Cain killed him.”
04-26|Genesis|There was also born to Seth a son, and he named him Eʹnosh. At that time people began calling on the name of Jehovah.
09-01|Genesis|God went on to bless Noah and his sons and to say to them: “Be fruitful and become many and fill the earth.
09-02|Genesis|A fear of you and a terror of you will continue upon every living creature of the earth and upon every flying creature of the heavens, upon everything that moves on the ground and upon all the fish of the sea. They are now given into your hand.
09-03|Genesis|Every moving animal that is alive may serve as food for you. Just as I gave you the green vegetation, I give them all to you.
09-04|Genesis|Only flesh with its life—its blood—you must not eat.
09-05|Genesis|Besides that, I will demand an accounting for your lifeblood. I will demand an accounting from every living creature; and from each man I will demand an accounting for the life of his brother.
09-06|Genesis|Anyone shedding man’s blood, by man will his own blood be shed, for in God’s image He made man.
09-07|Genesis|As for you, be fruitful and become many, and increase abundantly on the earth and multiply.”
09-08|Genesis|Then God said to Noah and to his sons with him:
09-09|Genesis|“I am now establishing my covenant with you and with your offspring after you,
09-10|Genesis|and with every living creature that is with you, the birds, the animals, and all the living creatures of the earth with you, all those that came out of the ark—every living creature of the earth.
09-11|Genesis|Yes, I establish my covenant with you: Never again will all flesh be destroyed by the waters of a flood, and never again will a flood bring the earth to ruin.”
09-12|Genesis|And God added: “This is the sign of the covenant that I am making between me and you and every living creature that is with you, for all future generations.
09-13|Genesis|I put my rainbow in the cloud, and it will serve as a sign of the covenant between me and the earth.
09-14|Genesis|Whenever I bring a cloud over the earth, then the rainbow will certainly appear in the cloud.
09-15|Genesis|And I will certainly remember my covenant that I made between me and you and every living creature of every kind; and never again will the waters become a flood to destroy all flesh.
09-16|Genesis|And the rainbow will occur in the cloud, and I will certainly see it and remember the everlasting covenant between God and every living creature of every kind on the earth.”
09-17|Genesis|God repeated to Noah: “This is the sign of the covenant that I establish between me and all flesh that is on the earth.”
09-18|Genesis|Noah’s sons who came out of the ark were Shem, Ham, and Jaʹpheth. Ham later became the father of Caʹnaan.
09-19|Genesis|These three were Noah’s sons, and all the earth’s population came from them and spread abroad.
09-20|Genesis|Now Noah started off as a farmer, and he planted a vineyard.
09-21|Genesis|When he drank of the wine, he became intoxicated, and he uncovered himself inside his tent.
09-22|Genesis|Ham, the father of Caʹnaan, saw his father’s nakedness, and he told his two brothers outside. 
09-23|Genesis|So Shem and Jaʹpheth took a garment and put it upon both their shoulders and walked in backward. Thus they covered their father’s nakedness while their faces were turned away, and they did not see their father’s nakedness.
09-24|Genesis|When Noah woke up from his wine and learned what his youngest son had done to him,
09-25|Genesis|he said: “Cursed be Caʹnaan. Let him become the lowest slave to his brothers.”
09-26|Genesis|And he added: “Praised be Jehovah, the God of Shem, And let Caʹnaan become a slave to him.
09-27|Genesis|Let God grant ample space to Jaʹpheth, And let him reside in the tents of Shem. Let Caʹnaan become a slave to him also.”
09-28|Genesis|Noah continued to live for 350 years after the Flood.
09-29|Genesis|So all the days of Noah amounted to 950 years, and he died.
13-01|Leviticus|Jehovah continued to speak to Moses and Aaron, saying:
13-02|Leviticus|“If a man develops on his skin a swelling, a scab, or a blotch and it could become the disease of leprosy on his skin, he must then be brought to Aaron the priest or to one of his sons, the priests.
13-03|Leviticus|The priest will examine the infection on his skin. When the hair in the infection has turned white and the appearance of the infection is deeper than the skin, it is the disease of leprosy. The priest will examine it and declare him unclean.
13-04|Leviticus|But if the blotch on his skin is white and its appearance is not deeper than the skin and the hair has not turned white, the priest will then quarantine the infected person for seven days.
13-05|Leviticus|The priest will then examine him on the seventh day, and if it appears that the infection has stopped and has not spread on the skin, the priest will quarantine him for another seven days.
13-06|Leviticus|“The priest should examine him again on the seventh day, and if the infection has faded and has not spread in the skin, the priest will declare him clean; it was only a scab. The man will then wash his garments and be clean.
13-07|Leviticus|But if the scab has definitely spread on the skin after he appears before the priest to establish his purification, he will then appear again before the priest.
13-08|Leviticus|The priest will examine it, and if the scab has spread in the skin, the priest will then declare him unclean. It is leprosy.
13-09|Leviticus|“If the disease of leprosy develops in a man, he must then be brought to the priest,
13-10|Leviticus|and the priest will examine him. If there is a white swelling on the skin and it has turned the hair white and there is an open sore in the swelling,
13-11|Leviticus|it is chronic leprosy on his skin, and the priest will declare him unclean. He should not quarantine him, for he is unclean.
13-12|Leviticus|Now if the leprosy breaks out all over the skin and the leprosy covers the person with the disease from head to foot, as far as the priest can see,
13-13|Leviticus|and the priest has examined him and sees that the leprosy has covered all his skin, he will then declare the infected person clean. All of it has turned white, and he is clean.
13-14|Leviticus|But whenever an open sore appears in it, he will be unclean.
13-15|Leviticus|When the priest sees the open sore, he will declare him unclean. The open sore is unclean. It is leprosy.
13-16|Leviticus|But if the open sore again turns white, he will then come to the priest.
13-17|Leviticus|The priest will examine him, and if the infection has turned white, the priest will then declare the infected person clean. He is clean.
13-18|Leviticus|“If a person develops a boil on his skin and it heals,
13-19|Leviticus|but in the place of the boil a white swelling or a reddish-white blotch has developed, he must then show himself to the priest.
13-20|Leviticus|The priest will examine it, and if it appears to be deeper than the skin and its hair has turned white, the priest will then declare him unclean. It is the disease of leprosy that has broken out in the boil.
13-21|Leviticus|But if the priest examines it and sees that there is no white hair in it and it is not deeper than the skin and appears faded, the priest will then quarantine him for seven days.
13-22|Leviticus|And if it has clearly spread on the skin, the priest will then declare him unclean. It is a disease.
13-23|Leviticus|But if the blotch stays in one place and has not spread, it is only the inflammation from the boil, and the priest will declare him clean.
13-24|Leviticus|“Or if someone has a scar from the fire and the raw flesh of the scar becomes a reddish-white blotch or a white one,
13-25|Leviticus|the priest will then examine it. If the hair in the blotch has turned white and it appears to be deeper than the skin, it is leprosy that has broken out in the scar, and the priest will declare him unclean. It is the disease of leprosy.
13-26|Leviticus|But if the priest examines it and sees that there is no white hair in the blotch and it is not deeper than the skin and it is faded, the priest will then quarantine him for seven days.
13-27|Leviticus|The priest will examine him on the seventh day, and if it has clearly spread on the skin, the priest will then declare him unclean. It is the disease of leprosy.
13-28|Leviticus|But if the blotch stays in one place and has not spread over the skin and it is faded, it is only a swelling of the scar, and the priest will declare him clean, because it is an inflammation of the scar.
13-29|Leviticus|“When a man or a woman develops an infection on the head or on the chin,
13-30|Leviticus|the priest will then examine the infection. If it appears to be deeper than the skin and the hair is yellow and thin, the priest will then declare such one unclean; it is an infection of the scalp or the beard. It is leprosy of the head or of the chin.
13-31|Leviticus|But if the priest sees that the infection does not appear to be deeper than the skin and there is no black hair in it, the priest should quarantine the infected person for seven days.
13-32|Leviticus|The priest will examine the infection on the seventh day, and if the infected area has not spread and no yellow hair has developed in it and the appearance of the infected area is not deeper than the skin,
13-33|Leviticus|the person should have himself shaved, but he will not have the infected area shaved. Then the priest will quarantine the infected person for seven days.
